{
  "id": "BEAM_SPAN_CHAPEAUX_RELEVES",
  "elementType": "E-BEM-01",
  "label_fr": "Travée — chapeaux + aciers filants + cadres",
  "label_en": "Span — chapeaux + straight bars + stirrups",
  "baseGroups": [
    {
      "role": "PRIMARY_LONGITUDINAL",
      "zone": "As_span_bottom",
      "shape": "DROITE",
      "placement": { "rule": "BOTTOM_LAYER", "faces": ["BOTTOM"], "count": "param" }
    },
    {
      "role": "PRIMARY_LONGITUDINAL",
      "zone": "As_top_support",
      "shape": "CHAPEAU",
      "placement": { "rule": "TOP_SUPPORT", "faces": ["TOP"], "count": "param" }
    },
    {
      "role": "TRANSVERSE",
      "zone": "Asw_shear",
      "shape": "ETRIER",
      "placement": { "rule": "ALONG_PATH", "path": { "ref": "BEAM_LENGTH" }, "spacing": "param" }
    }
  ],
  "supplementalCatalog": ["SUPP_RELEVE_BARS", "SUPP_SKIN_SIDE", "SUPP_DOUBLE_STIRRUP_SUPPORT"],
  "validationProfile": "BAEL_BEAM"
}
